Post Title,URL,Content
Diabetes and Breastfeeding,https://laleche.org.uk/diabetes-and-breastfeeding/,"Breastfeeding is the normal and natural way to feed and nurture a baby. If you have diabetes you may be concerned about whether you can breastfeed. The answer is yes.All mothers experience metabolic and hormonal changes after giving birth. A mother with diabetes who breastfeeds has an advantage as breastfeeding reduces the impact of these changes. When you breastfeed, your body continues to support you and your baby, making your diabetes easier to manage in the days after birth. Later on, gradual weaning helps you to maintain control of your diabetes.Gestational diabetesBenefits of breastfeedingWhat about medications?Be preparedBlood glucose controlLarger babyBabies can have a hypo after birthAntenatal expression of colostrumGet breastfeeding off to a good startLooking after yourselfAdjusting your dietGestational diabetesIt can be a shock if you are diagnosed with gestational diabetes during your pregnancy. This is usually a temporary condition in which your body fails to produce enough insulin to meet your extra needs while you are pregnant. It is usually diagnosed from the fourth month of pregnancy. Just like mothers who are on long-term treatment for diabetes, good control of blood glucose levels will minimise any problems for you and your baby. You may not need any extra medical care during labour and delivery. Diabetes treatment is usually unnecessary once you have given birth.Benefits of breastfeedingFor you (as a diabetic mother)Breastfeeding increases your insulin sensitivity and has long term positive effects on your glucose metabolism.• For Type-1 diabetes, breastfeeding will reduce the amount of insulin you need.• For Type-2 diabetes, breastfeeding will reduce the severity of your diabetes.• For Gestational diabetes, breastfeeding significantly reduces your risk of developing diabetes later in life.Breastfeeding suppresses your periods and monthly hormonal changes.See our pageAmazing milkfor more information.For your babyStudies show that your baby will behealthier throughout their lifeif they are breastfed. Infant formula increases a baby’s chance of developing diabetes.What about medicationsInsulin treatment is compatible with breastfeeding. Insulin molecules are too large to pass into your milk. Check with your doctor for up-to-date information on any other medications you take. If there is any concern over safety, an LLL Leader can obtain information on named medications for you.Be preparedHaving diabetes can increase the risk of the following problems which may impact breasfeeding:• Premature birth•Caesarean birth• Newborn hypoglycaemia (low blood sugar)•Newborn jaundice.See Further reading at the end of the page for a selection of resources to help avoid these problems and overcome difficulties. You may also like to find out about your local hospital’s policies on the management of these and care of diabetic mothers during and after pregnancy.Do ask if the hospital has an Infant Feeding Advisor who will be well informed about breastfeeding and a source of support in those early days.Blood glucose controlThis is the key to avoiding problems in pregnancy, labour and after birth.If you are planning a pregnancy, practise good diabetes management before you conceive too.• Frequent antenatal and diabetes medical care will allow you to address any problems quickly.• Discuss with the doctors, nurses and dieticians in your diabetes team how to control your changing needs for insulin, other medication and food while pregnant and after birth.• You may be given a Continuous Glucose Monitor (CGM) which will notify you if your blood glucose levels get too high or too low.• Monitor your blood glucose levels closely, so you can adjust your insulin, other medication and food intake.You may need to eat frequent smaller meals a day to avoid hypos (hypoglycaemia or low blood glucose levels) and peaks in blood glucose levels.Larger babyEven with excellent control, diabetic mothers tend to have larger than average babies. Good blood glucose control will help limit how large your baby grows, making birth easier and reducing the risk of complications.Babies can have a hypo after birthYour baby will be prone to hypoglycaemia (low blood glucose levels) during the first 12 hours after birth, particularly if you have poor blood glucose control in pregnancy. Even with good control, your baby will have been used to relatively high levels of glucose before he was born. The extra insulin he produces can lead to a drop in blood glucose after birth. Skin-to-skin contact, and early frequent breastfeeding will help avoid problems.Check your hospital’s policy for testing blood glucose levels and treating a baby’s hypo. Your colostrum (first milk) is the best food for your baby if he has a hypo. If your baby has not breastfed yet, stored colostrum can be given.Antenatal expression of colostrumIn the last few weeks of pregnancy you can express some colostrum (early milk). This can be given to your baby if he can’t breastfeed after birth, or he needs supplements for any reason eg hypoglycaemia. Our information sheetAntenatal Expression of Colostrumexplains how to do this before birth so you have some of your milk immediately available for your baby should he need any supplement.Get breastfeeding off to a good startThe first few daysFor many mothers with diabetes, milk production increases later than for mothers who don’t have diabetes. You can help your milk production increase normally on the third or fourth day with good control of blood glucose. Fluctuations in insulin levels will affect milk production, and increase the risk of your baby needing supplements.Get skilled breastfeeding help sooner rather than later to reduce the need for supplements.Your baby will need to stay in hospital for at least 24 hours after birth, until he is feeding well and maintaining blood glucose levels.Breastfeeding basics• Hold your baby against your skin after birth so he can breastfeed as soon as possible, ideally within the first hour after birth.• Keep your baby with you unless separation is medically necessary.• Try to breastfeed every hour for the first several hours, until your baby’s blood glucose levels stabilise. Ensure your baby feeds at least 8-12 times each 24 hour period.• Spend as much time as you can holding your baby and encouraging him to feed frequently.Separation and supplementsTake action if you and your baby are separated or if your baby needs supplements for any reason.• Hand express small amounts of colostrum frequently to give to your baby. This will also help you establish milk production.• Once you can express larger amounts, you can use a hospital-grade pump.• Your baby can be given your milk with a syringe, cup or spoon.Being separated from your new baby will be hard for you. As soon as you can, spend as much time as possible with him to help make up for lost time. Even visiting him in the neonatal intensive care (NICU) or special care baby unit (SCBU) will help, as you will be able to touch, stroke and talk to him and take over some of his care. You can ask to give him kangaroo mother care, in which a baby is snuggled skin-to-skin against mum’s chest. Kangaroo care helps to stabilise a baby’s heartbeat, temperature and breathing, and encourages breastfeeding. The hormones produced will help you express your milk, even if you can’t breastfeed straight away.Looking after yourselfAfter birthAt first your blood glucose levels can change rapidly and you are at increased risk of having a hypo. Take suitable snacks into hospital so you have something readily available —and watch out for early signs of hypos.Later you’ll have to manage your own health while caring for your baby. Keep suitable snacks and drinks within arms reach in all the places you are likely to breastfeed your baby to treat hypos at the first signs.Seek skilled help straight away if you experience sore nipples or breasts, to reduce the risk of an infection. You are more at risk from a thrush infection of the nipple area if you have diabetes.Rest when you canLack of sleep can make it harder to manage your diabetes and be a cause of stress, which means youor blood glucose levels will run higher. Try to rest when your baby sleeps and accept offers of practical help from others when you need to.Adjusting your dietBreastfeeding helps your body adjust gradually to the metabolic and hormonal changes all mothers experience after birth.You may need to eat many more extra calories a day while breastfeeding, eating regularly to maintain blood sugar levels. This will allow you to use your fat stores without the risk of ketones in your blood and urine.Further supportYourlocal LLL Leader and Groupcan be a source of information and support. You may also find it helpful to meet with other mothers at your local LLL group. You will be able to share practical tips on breastfeeding and mothering and find out what is normal for a breastfed baby.Written by Karen Butler and mothers of LLLGBFurther ReadingPositioning & attachmentPositioning & Attachment(Kindle publication)Antenatal Expression of ColostrumBirth & BreastfeedingBeginning BreastfeedingCaesarean Birth & BreastfeedingComfortable BreastfeedingHand Expression of BreastmilkIs My Baby Getting Enough Milk?Jaundice in Healthy NewbornsMy Baby Won’t BreastfeedSleepy Baby – why and what to doThrushSkin-to-skinBooksThe Womanly Art of Breastfeeding, LLLI. London: Pinter & Martin, 2010.Breastfeeding Answers Made Simple. Mohrbacher, N. Amarillo, TX: Hale Publishing 2010.Benefits of skin-to-skin contactwww.kangaroomothercare.comReferencesCox, SG. An ethical dilemma: should recommending antenatal expressing and storing of colostrum continue?Breastfeeding Review2010; 18(3):5–7.http://pages.ca.inter.net/~jfisher/docs/ Ethical_BFR_-Sue_Cox.pdf Cox, S.Expressing and storing colostrum antenatally for use in the newborn period.Breastfeeding ReviewNov 2006. Oscroft, R.Antenatal expression of colostrum.Pract Midwife2001;4 (4): 32–5.NICE Clinical Guideline 63: Diabetes in pregnancy management of diabetes and its complications from preconception to the postnatal period. National Collaborating Centre for Women’s and Children’s Health March 2008 (revised reprint July 2008):www.nice.org.uk/CG063You can buythis informationin printed form from our shopCopyright LLLGB 2020"
Smoking & Breastfeeding,https://laleche.org.uk/smoking-breastfeeding/,"Breastfeeding your baby is still the best choice you can make, even if you can’t stop smoking.Breastfeeding provides significant health benefits for mothers and babies. For babies, it reduces their risk of diabetes, certain cancers, respiratory infections, diarrhoea, and many other health problems. For mothers, it protects against breast cancer, helps with postnatal weight loss, and encourages a unique mother-child bond that can’t be duplicated.Breastfeeding is just as beneficial for the smoking mother and her baby as it is for the non-smoking mother and her baby. Research has shown that babies of smokers are at increased risk of colic, respiratory infections, and SIDS (Sudden Infant Death Syndrome or cot death).But breastfed babies are at lower risk for these diseases compared to artificially fed ones, even when their mothers continue to smoke.And breastfeeding helps to protect babies from the potential risks of cigarette smoke. Breastfeeding and smoking may well be less harmful to the child than bottle feeding and smoking.Cut down on smokingSmoke after breastfeedingMonitor your baby’s weightProtecting your baby against SIDSRelaxationNicotine replacement therapyContinue breastfeedingCut down on smokingFewer cigarettes smoked means less smoke in the air, lower levels of nicotine in your milk, better health for everyone, and more time with your baby. Smoke as far away from your baby as possible To prevent exposing your baby to smoke and particles small enough to inhale, any smoker in your household should smoke outside or at least in another room, away from your baby. Some health professionals suggest that family members who smoke should always wash their hands after smoking and before touching the baby. A smoker can also wear a jacket or other outer garment while smoking to protect clothing from smoke particles. This garment can then be removed before any contact with the baby so that the baby will be exposed to fewer smoke particles.Smoke after breastfeedingWhen a breastfeeding mother smokes, the nicotine levels in her blood and milk rise, and then fall over time. So, smoking straight after breastfeeding minimizes the amount of nicotine in your milk. About 95 minutes after smoking, the level of nicotine in a mother’s blood and milk has fallen by about half. Your baby will probably want to nurse frequently in the early weeks, so you won’t always be able to wait that long between smoking and the next feed. Frequent breastfeeding is good for your milk production and ensures that your baby gets enough to eat. Medications and Mothers’ Milk by Thomas Hale, 2012, states “Mothers should be advised to limit smoking as much as possible and to smoke only after they have fed their infant, or to switch to the use of nicotine patches.”Monitor your baby’s weightSome research suggests that smoking affects a baby’s weight gain, while other research shows no difference between babies of smoking and non-smoking mothers. So, monitor your baby’s weight regularly and talk to anLLL Leaderor your health visitor about any concerns. There are simple ways to increase your milk production.Protecting your baby against SIDSSmoking increases the likelihood of your baby suffering Sudden Infant Death Syndrome (SIDS), also known as cot death. Sharing a room with your baby for at least the first 6 months helps to protect against SIDS and also helps with night-time breastfeeding. If you or your partner smoke, you should make sure that you never fall asleep with your baby in bed. Your baby’s risk of SIDS is increased if he sleeps in a bed with a smoker. You shouldnever sleep with your baby on a sofa or armchair, whether you are a smoker or not (UNICEF 2011). See our page onSafe Sleep & the Breastfed Baby.RelaxationSmoking is a stress-relieving mechanism for many people. Finding other ways of relaxing can help you cope with nicotine withdrawal:Enjoy cuddling and playing with your baby.Go for a walk, get some fresh air, visit the park and feed the ducks. Take him swimming.Get some rest. Use the relaxation exercises taught in pregnancy. Or have a shower or bath.Read a book or magazine; chat to other mums on social media, findLLLGB Facebook groupsand pages . Crafts like knitting can occupy your hands.Take advantage of non smoking public places to avoid temptation.Meet up with other mothers, including atLLL meetings.Nicotine replacement therapyCommercial products may help you to give up smoking and their use protects your whole family from carbon monoxide and respiratory irritants in the air. It is worth asking a health professional about the most appropriate therapy and dosage to meet your needs. Use nicotine gum, lozenges, microtabs or nasal spray immediately after a breastfeed so that blood levels of nicotine have time to fall before the next feed. This may be 2 to 3 hours for nicotine gum. Nicotine patches provide a steady level of nicotine in your blood and milk. That level can be lower than the level of nicotine when smoking—use a patch with the lowest level of nicotine possible to satisfy your cravings. Remove the patch at night to reduce levels of nicotine during night-time feeds. Research has shown that use of nicotine patches is a safer option than continuing to smoke.Hale 2012 states: “The risk of using nicotine patches while breastfeeding is much less than the risk of formula feeding.” Nicotine inhalers give lower blood levels of nicotine than cigarettes, and levels of nicotine are probably too low to affect a breastfeeding baby (Hale 2012).Electronic cigarettes have not been well studied and are not recommended. NEVER smoke cigarettes when using nicotine replacement products. Smoking while using replacement products may produce dangerous levels of nicotine in your blood and milkContinue breastfeedingThere is no need to stop breastfeeding because you are smoking. Remember that breastfeeding offers your baby protection from the very respiratory diseases you may be worried about.There are plenty of reasons to stop smoking, both for you and your baby. You’ve probably heard about many of them already. Decide what is realistic for you to do, based on your own circumstances. You could stop smoking during pregnancy and while you are breastfeeding. Otherwise try to minimize the effects by smoking away from your baby, allowing as much time as possible between smoking a cigarette and the next breastfeed, and by keeping the number of cigarettes smoked per day as low as possible.Less smoking in your household will be good for your whole family’s health, not just your baby’s. Stop or cut down if you possibly can, but remember that even if you can’t, breastfeeding still provides significant health benefits for both you and your baby. If you would like to discuss this with an LLL Leader you can call ourHelpline. A Leader will also be able to give you information aboutLLL meetingswhere you can chat with other breastfeeding mothers.Adapted by Karen Butler and mothers of LLLGB from an original text by LLLI with thanks to Amy Conway and Kathy Koch, IBCLC for their help with compiling the original information.Inclusion of pictures does not imply that the mothers smoke.Further ReadingAdjusting To MotherhoodIs My Baby Getting Enough Milk?Rhythms & RoutinesSafe Sleep & the Breastfed BabyBooksThe Womanly Art of Breastfeeding. LLLI. London: Pinter & Martin, 2010.Breastfeeding Today articlesSmoking CigarettesFurther InformationNHS information on giving up smoking Website:www.smokefree.nhs.ukNHS free smoking helpline: 0800 022 4332UNICEF:Caring for your baby at night– information for parents and health professionalsReferencesBreastfeeding Answers Made Simple. Mohrbacher, N. Amarillo, TX: Hale Publishing, 2010.Medications and Mothers’ Milk. Hale, T. Amarillo, TX: Hale Publishing, 2012.Amir, L.H. Maternal smoking and reduced duration of breastfeeding: a review of possible mechanisms.Early Hum Dev 2001; 64(1):45-67. Haug, K. et al.Secular trends in breastfeeding and parental smoking. Acta Paediatr 1998; 187(10):1023-27. Ilett, K.F. et al.Use of nicotine patches in breastfeeding mothers: Transfer of nicotine and cotinine into human milk. Clin Pharmacol Ther 2003; 74(6):516-24. Mennella, J.A. et al.Breastfeeding and Smoking short-term effects on infant feeding and sleep. Pediatrics, 2007; 120:497-502. Nafstad, P. et al.Breastfeeding, maternal smoking and lower respiratory tract infections. Eur Respir J 1996; 9:2623-29. Ratner, P. et al.Smoking relapse and early weaning among postpartum women: is there an association? Birth 1999; 26(1):76-82. Steldinger, R. and Luck, W.Half lives of nicotine in milk of smoking mothers: implications for nursing. J Perinat Med 1988; 16:261-62. Woodward, A. et al.Acute respiratory illness in Adelaide children: breastfeeding modifies the effect of passive smoking. J Epidemiol Community Health 1990; 44:224-230.This informationis available in printed form from the LLLGB shop.Copyright LLLGB 2016"
Breastfeeding and Jury Service,https://laleche.org.uk/breastfeeding-and-jury-servic/,"If a woman is summoned for jury service while still breastfeeding it has sometimes proved stressful to get exemption from serving. There can be a lack of understanding and knowledge and an assumption is made that formula can be substituted.  If a simple explanation that a woman is breastfeeding and cannot leave her baby is not accepted then it may be possible to use some of these suggestions.Equality Act 2010Possible risks for mother and babyHuman Rights ActDoctor’s letterEquality Act 2010Under the Equality Act 2010 it is sex discrimination to fail to assess or take action on health and safety risks for a breastfeeding woman where the work could involve risks with serious consequences for mother or baby.It is indirect sex discrimination under the Equality Act for an employer to refuse a flexible working request from a breastfeeding mother if there are not good business reasons for the refusal, and if it results in the mother stopping breastfeeding. This could be applied to being asked to leave a baby.Possible risks for mother and babyRisks for a mother developingengorgementormastitis, a very painful condition, because she will not be able to feed her baby while in court, and there may not be the facilities or time for her to express.It will also be emotionally difficult, and the stress of being separated from her baby, along with discomfort and anxiety may mean it will be hard for her to listen carefully to evidence.  If she feels that the court’s inability to make provision for her health situation will compromise her ability to listen, absorb and assess the evidence then this needs to be made clear.  Not only are the juror’s rights being compromised but the accused has a right to a just and fair trial, which might be affected if the mother is feeling ill.Risks for the baby include the unavailability of breastfeeding to provide nourishment and comfort.  It is often assumed that a baby can just take milk from a bottle but the action of feeding is very different and many cannot adjust.  A baby should not have to have formula against a mother’s wishes, and it takes time to build up an adequate supply of expressed milk. The baby may feel emotional distress being away from his mother.Being separated will also mean that milk supply will drop down with consequences for the future.  It may take time for the mother to increase her supply once more, and lead to distress for her and the baby.Human Rights ActIt may also be possible to object to serving under article 8 Human Rights Act.  This applies to a woman’s rights to physical integrity. She might also argue that it is inhuman and degrading to be preventing from removing milk from her body, particularly is she is also refused the right to pump.  If a mother is told she cannot pump while serving on a jury she might complain to court staff or the judge that article 3 of the Human Rights Act (inhumane and degrading treatment) might be breached.Courts are a public body and, as such, must respect and adhere to the human rights of anyone within the court system. A mother would need to make it clear that she is being put at serious health risk by not being allowed to express breastmilk.For some women simply having court staff who are supportive and pleasant, and being provided with facilities toexpresswould make it possible for them to serve on a jury.Doctor’s letterIt may be possible to ask a doctor to provide a letter stating a woman is breastfeeding and is not eligible for jury service.  It is to be hoped that courts now have a better understanding of breastfeeding and that in future women can decline jury service without being involved in a stressful situation.If you still have concerns about  your summons for jury service you can talk to anLLL Leader.Written by Anna Burbidge.Further ReadingSupporting Women’s Right to BreastfeedThe Breastfeeding DyadCopyright LLLGB 2016"
